{
  "$schema": "https://json-schema.org/draft/2020-12/schema",
  "$id": "https://lattice.dev/schemas/metasensor.schema.json",
  "title": "MetaSensorDef",
  "description": "A declarative detector over player-behavior events (concept Phase 4): when Watch fires Threshold times within Window seconds for an agent, SetCondition is set on that agent \u2014 and existing brains react through their normal machinery. No special code path.",
  "type": "object",
  "properties": {
    "id": {
      "type": "string",
      "description": "Globally unique def ID."
    },
    "type": {
      "const": "metasensor"
    },
    "description": {
      "type": "string",
      "description": "One line for humans and LLMs (surfaced by the manifest)."
    },
    "inherits": {
      "type": "string",
      "description": "Parent def ID (same kind); objects deep-merge, scalars override, arrays replace or take {\u0022$append\u0022/\u0022$remove\u0022} patches.",
      "x-lattice-ref": "metasensor"
    },
    "watch": {
      "type": "string"
    },
    "window": {
      "type": "number"
    },
    "threshold": {
      "type": "number"
    },
    "setCondition": {
      "type": "string"
    },
    "agentKey": {
      "type": "string"
    }
  },
  "required": [
    "id",
    "type"
  ]
}